id,inputs,reference_outputs,session_name,repetition,outputs,run,status,error,latency,tokens,total_cost,answer_quality,faithfulness,latency,retrieval_relevance,semantic_similarity
c7bc2328-7d79-468f-a07d-d616dee2d6d7,"{""question"": ""What is JavaScript?""}","{""test_id"": ""js-001-what-is-js"", ""category"": ""javascript"", ""difficulty"": ""easy"", ""question_type"": ""factual"", ""expected_chunks"": [""javascript_tutorial_parent_6""], ""reference_answer"": ""JavaScript is a dynamic, lightweight, interpreted programming language commonly used for creating interactive web pages. It was first known as LiveScript and made its first appearance in Netscape 2.0 in 1995.""}",opt-v3-forced-search-f9c11837,1,"{""answer"": ""JavaScript is a lightweight, interpreted programming language designed for creating network-centric applications. Initially known as LiveScript, it was renamed to JavaScript by Netscape. It allows for building interactivity into static HTML pages and is integrated with HTML, making it easy to implement. Security reasons prevent client-side JavaScript from reading or writing files."", ""retrieved_chunks"": [""javascript_tutorial_parent_6"", ""javascript_tutorial_parent_9"", ""javascript_tutorial_parent_0""], ""retrieved_docs"": ""- Javascript is a dynamic computer programming language.\n- It is lightweight and most commonly used as a part of web pages, whose implementations allow client-side script to interact with the user and make dynamic pages.\n- JavaScript was first known as **LiveScript**, but Netscape changed its name to JavaScript.\n\n---\n\n- Client-side JavaScript does not allow the reading or writing of files. This has been kept for security reason.\n- JavaScript is a lightweight, interpreted programming language that allows you to build interactivity into otherwise static HTML pages.\n\n---\n\n- JavaScript is a lightweight, interpreted programming language.\n- It is designed for creating network-centric applications.\n- It is complimentary to and integrated with Java.\n- JavaScript is very easy to implement because it is integrated with HTML.\n- It is open and cross-platform.""}","{""inputs"": {""question"": ""What is JavaScript?""}, ""outputs"": {""answer"": ""JavaScript is a lightweight, interpreted programming language designed for creating network-centric applications. Initially known as LiveScript, it was renamed to JavaScript by Netscape. It allows for building interactivity into static HTML pages and is integrated with HTML, making it easy to implement. Security reasons prevent client-side JavaScript from reading or writing files."", ""retrieved_chunks"": [""javascript_tutorial_parent_6"", ""javascript_tutorial_parent_9"", ""javascript_tutorial_parent_0""], ""retrieved_docs"": ""- Javascript is a dynamic computer programming language.\n- It is lightweight and most commonly used as a part of web pages, whose implementations allow client-side script to interact with the user and make dynamic pages.\n- JavaScript was first known as **LiveScript**, but Netscape changed its name to JavaScript.\n\n---\n\n- Client-side JavaScript does not allow the reading or writing of files. This has been kept for security reason.\n- JavaScript is a lightweight, interpreted programming language that allows you to build interactivity into otherwise static HTML pages.\n\n---\n\n- JavaScript is a lightweight, interpreted programming language.\n- It is designed for creating network-centric applications.\n- It is complimentary to and integrated with Java.\n- JavaScript is very easy to implement because it is integrated with HTML.\n- It is open and cross-platform.""}, ""session_id"": ""2f73e6dd-8a77-431f-8ca4-49a3a00f954a"", ""error"": null, ""extra"": {""metadata"": {""__ls_runner"": ""py_sdk_evaluate"", ""description"": ""Graph-enforced search - structurally impossible to skip search"", ""example_version"": ""2026-01-18T13:28:01.843460+00:00"", ""experiment_id"": ""opt-v3-forced-search"", ""experiment_name"": ""Optimized V3 (Forced Search)"", ""ls_example_category"": ""javascript"", ""ls_example_dataset_split"": [""base""], ""ls_example_difficulty"": ""easy"", ""ls_example_question_type"": ""factual"", ""ls_example_test_id"": ""js-001-what-is-js"", ""ls_method"": ""traceable"", ""ls_run_depth"": 0, ""num_repetitions"": 1, ""revision_id"": ""ad71701-dirty"", ""version"": ""1.0""}, ""runtime"": {""langchain_core_version"": ""1.2.7"", ""langchain_version"": ""1.2.4"", ""library"": ""langsmith"", ""platform"": ""macOS-26.1-arm64-arm-64bit"", ""py_implementation"": ""CPython"", ""runtime"": ""python"", ""runtime_version"": ""3.11.14"", ""sdk"": ""langsmith-py"", ""sdk_version"": ""0.6.4""}}, ""run_type"": ""chain"", ""id"": ""019bd497-0c68-7f61-a74f-e78a27129266"", ""status"": ""success""}",success,,18.387,1704,,1.0,0.8,18.387,0.7,0.9375
cd008d9b-17db-4602-ab73-0f5356ccf7f2,"{""question"": ""Tell me about machine learning""}","{""test_id"": ""edge-002-ml"", ""category"": ""edge-case"", ""difficulty"": ""hard"", ""question_type"": ""out-of-scope"", ""expected_chunks"": [], ""reference_answer"": ""NOT_IN_DOCUMENTS - Machine learning is not covered in the available documents about JavaScript and Blockchain.""}",opt-v3-forced-search-f9c11837,1,"{""answer"": ""The documents don't contain this information."", ""retrieved_chunks"": [""javascript_tutorial_parent_4""], ""retrieved_docs"": ""## **Table of Contents**  \nAbout the Tutorial .............................................................................................................................................\nAudience ..........................................................................................................""}","{""inputs"": {""question"": ""Tell me about machine learning""}, ""outputs"": {""answer"": ""The documents don't contain this information."", ""retrieved_chunks"": [""javascript_tutorial_parent_4""], ""retrieved_docs"": ""## **Table of Contents**  \nAbout the Tutorial .............................................................................................................................................\nAudience ..........................................................................................................""}, ""session_id"": ""2f73e6dd-8a77-431f-8ca4-49a3a00f954a"", ""error"": null, ""extra"": {""metadata"": {""__ls_runner"": ""py_sdk_evaluate"", ""description"": ""Graph-enforced search - structurally impossible to skip search"", ""example_version"": ""2026-01-18T13:28:11.775768+00:00"", ""experiment_id"": ""opt-v3-forced-search"", ""experiment_name"": ""Optimized V3 (Forced Search)"", ""ls_example_category"": ""edge-case"", ""ls_example_dataset_split"": [""base""], ""ls_example_difficulty"": ""hard"", ""ls_example_question_type"": ""out-of-scope"", ""ls_example_test_id"": ""edge-002-ml"", ""ls_method"": ""traceable"", ""ls_run_depth"": 0, ""num_repetitions"": 1, ""revision_id"": ""ad71701-dirty"", ""version"": ""1.0""}, ""runtime"": {""langchain_core_version"": ""1.2.7"", ""langchain_version"": ""1.2.4"", ""library"": ""langsmith"", ""platform"": ""macOS-26.1-arm64-arm-64bit"", ""py_implementation"": ""CPython"", ""runtime"": ""python"", ""runtime_version"": ""3.11.14"", ""sdk"": ""langsmith-py"", ""sdk_version"": ""0.6.4""}}, ""run_type"": ""chain"", ""id"": ""019bd48b-11d2-7aa3-b4ca-38584f322c8b"", ""status"": ""success""}",success,,74.2525,4187,,0.4,0.0,74.2525,0.3,0.2886
eda58305-c17f-4655-8a09-e3624d686fd9,"{""question"": ""What are the different consensus mechanisms?""}","{""test_id"": ""bc-005-consensus"", ""category"": ""blockchain"", ""difficulty"": ""medium"", ""question_type"": ""factual"", ""expected_chunks"": [""Blockchain_For_Beginners_A_EUBOF_Guide_parent_7""], ""reference_answer"": ""Main consensus mechanisms include: Proof of Work (PoW) - miners solve puzzles, used by Bitcoin; Proof of Stake (PoS) - validators stake cryptocurrency; Delegated PoS (dPoS) - stakeholders vote for delegates; Proof of Authority (PoA) - approved validators, faster but less decentralized.""}",opt-v3-forced-search-f9c11837,1,"{""answer"": ""The documents don't contain this information."", ""retrieved_chunks"": [""Blockchain_For_Beginners_A_EUBOF_Guide_parent_7"", ""Blockchain_For_Beginners_A_EUBOF_Guide_parent_5""], ""retrieved_docs"": ""- A practical example of how decentralization works on blockchain is Bitcoin (see previous section).\n- When we discuss blockchain cryptography, this entails the following components:\n- **Digital Signatures:** the purpose of digital signatures is to ensure security and authenticity.\n- Hash Functions are used to maintain the integrity and the order of the blockchain.\n\n---\n\n- **Consensus Mechanism:** A consensus mechanism is a way to achieve agreement on a single data value among distributed processes or systems. In the context of blockchain, it's a set of rules or protocols that decide on the validity of the information added to the ledger.\n- NONE""}","{""inputs"": {""question"": ""What are the different consensus mechanisms?""}, ""outputs"": {""answer"": ""The documents don't contain this information."", ""retrieved_chunks"": [""Blockchain_For_Beginners_A_EUBOF_Guide_parent_7"", ""Blockchain_For_Beginners_A_EUBOF_Guide_parent_5""], ""retrieved_docs"": ""- A practical example of how decentralization works on blockchain is Bitcoin (see previous section).\n- When we discuss blockchain cryptography, this entails the following components:\n- **Digital Signatures:** the purpose of digital signatures is to ensure security and authenticity.\n- Hash Functions are used to maintain the integrity and the order of the blockchain.\n\n---\n\n- **Consensus Mechanism:** A consensus mechanism is a way to achieve agreement on a single data value among distributed processes or systems. In the context of blockchain, it's a set of rules or protocols that decide on the validity of the information added to the ledger.\n- NONE""}, ""session_id"": ""2f73e6dd-8a77-431f-8ca4-49a3a00f954a"", ""error"": null, ""extra"": {""metadata"": {""__ls_runner"": ""py_sdk_evaluate"", ""description"": ""Graph-enforced search - structurally impossible to skip search"", ""example_version"": ""2026-01-18T13:28:08.393454+00:00"", ""experiment_id"": ""opt-v3-forced-search"", ""experiment_name"": ""Optimized V3 (Forced Search)"", ""ls_example_category"": ""blockchain"", ""ls_example_dataset_split"": [""base""], ""ls_example_difficulty"": ""medium"", ""ls_example_question_type"": ""factual"", ""ls_example_test_id"": ""bc-005-consensus"", ""ls_method"": ""traceable"", ""ls_run_depth"": 0, ""num_repetitions"": 1, ""revision_id"": ""ad71701-dirty"", ""version"": ""1.0""}, ""runtime"": {""langchain_core_version"": ""1.2.7"", ""langchain_version"": ""1.2.4"", ""library"": ""langsmith"", ""platform"": ""macOS-26.1-arm64-arm-64bit"", ""py_implementation"": ""CPython"", ""runtime"": ""python"", ""runtime_version"": ""3.11.14"", ""sdk"": ""langsmith-py"", ""sdk_version"": ""0.6.4""}}, ""run_type"": ""chain"", ""id"": ""019bd48f-712a-77a1-8786-a6f2a862ce85"", ""status"": ""success""}",success,,46.5702,5697,,0.4,0.5,46.5702,0.7,-0.006
f431cc8c-07e1-4f2d-9578-f8ea0ccd5bde,"{""question"": ""How do I write my first JavaScript code?""}","{""test_id"": ""js-004-first-code"", ""category"": ""javascript"", ""difficulty"": ""medium"", ""question_type"": ""conceptual"", ""expected_chunks"": [""javascript_tutorial_parent_12""], ""reference_answer"": ""Place JavaScript code within <script>...</script> tags in HTML. Use document.write() to output text. Example: <script type='text/javascript'>document.write('Hello World!')</script>""}",opt-v3-forced-search-f9c11837,1,"{""answer"": ""To write your first JavaScript code, you can place it between `<script>` tags within the `<head>` or `<body>` sections of an HTML document. For using external files, create a \"".js\"" file with your JavaScript code and include it in your HTML with the `<script>` tag."", ""retrieved_chunks"": [""javascript_tutorial_parent_6"", ""javascript_tutorial_parent_21"", ""javascript_tutorial_parent_12"", ""javascript_tutorial_parent_25""], ""retrieved_docs"": ""- JavaScript is a lightweight, interpreted programming language.\n\n---\n\n- You can put your JavaScript code in <head> and <body> section altogether as follows.\n- To use JavaScript from an external file source, you need to write all your JavaScript source code in a simple text file with the extension \"".js\"" and then include that file as shown above.\n\n---\n\n- The script tag alerts the browser program to start interpreting all the text between these tags as a script.\n- Your JavaScript syntax will look as follows.\n- This function can be used to write text, HTML, or both.\n\n---\n\n- Value of a => (a = b) =>\n- result = (a = b);\n- Value of a => (a += b) =>\n- result = (a += b);\n- Value of a => (a -= b) =>\n- result = (a -= b);\n- Value of a => (a *= b) =>\n- result = (a *= b);""}","{""inputs"": {""question"": ""How do I write my first JavaScript code?""}, ""outputs"": {""answer"": ""To write your first JavaScript code, you can place it between `<script>` tags within the `<head>` or `<body>` sections of an HTML document. For using external files, create a \"".js\"" file with your JavaScript code and include it in your HTML with the `<script>` tag."", ""retrieved_chunks"": [""javascript_tutorial_parent_6"", ""javascript_tutorial_parent_21"", ""javascript_tutorial_parent_12"", ""javascript_tutorial_parent_25""], ""retrieved_docs"": ""- JavaScript is a lightweight, interpreted programming language.\n\n---\n\n- You can put your JavaScript code in <head> and <body> section altogether as follows.\n- To use JavaScript from an external file source, you need to write all your JavaScript source code in a simple text file with the extension \"".js\"" and then include that file as shown above.\n\n---\n\n- The script tag alerts the browser program to start interpreting all the text between these tags as a script.\n- Your JavaScript syntax will look as follows.\n- This function can be used to write text, HTML, or both.\n\n---\n\n- Value of a => (a = b) =>\n- result = (a = b);\n- Value of a => (a += b) =>\n- result = (a += b);\n- Value of a => (a -= b) =>\n- result = (a -= b);\n- Value of a => (a *= b) =>\n- result = (a *= b);""}, ""session_id"": ""2f73e6dd-8a77-431f-8ca4-49a3a00f954a"", ""error"": null, ""extra"": {""metadata"": {""__ls_runner"": ""py_sdk_evaluate"", ""description"": ""Graph-enforced search - structurally impossible to skip search"", ""example_version"": ""2026-01-18T13:28:03.072466+00:00"", ""experiment_id"": ""opt-v3-forced-search"", ""experiment_name"": ""Optimized V3 (Forced Search)"", ""ls_example_category"": ""javascript"", ""ls_example_dataset_split"": [""base""], ""ls_example_difficulty"": ""medium"", ""ls_example_question_type"": ""conceptual"", ""ls_example_test_id"": ""js-004-first-code"", ""ls_method"": ""traceable"", ""ls_run_depth"": 0, ""num_repetitions"": 1, ""revision_id"": ""ad71701-dirty"", ""version"": ""1.0""}, ""runtime"": {""langchain_core_version"": ""1.2.7"", ""langchain_version"": ""1.2.4"", ""library"": ""langsmith"", ""platform"": ""macOS-26.1-arm64-arm-64bit"", ""py_implementation"": ""CPython"", ""runtime"": ""python"", ""runtime_version"": ""3.11.14"", ""sdk"": ""langsmith-py"", ""sdk_version"": ""0.6.4""}}, ""run_type"": ""chain"", ""id"": ""019bd495-77ed-7b12-a7f3-e9f52bbb780e"", ""status"": ""success""}",success,,27.3192,3276,,1.0,0.8,27.3192,0.5,0.748
ff4f0c17-39f3-43bf-aae1-a6361c15c857,"{""question"": ""What is decentralization in blockchain?""}","{""test_id"": ""bc-003-decentralization"", ""category"": ""blockchain"", ""difficulty"": ""easy"", ""question_type"": ""factual"", ""expected_chunks"": [""Blockchain_For_Beginners_A_EUBOF_Guide_parent_5"", ""Blockchain_For_Beginners_A_EUBOF_Guide_parent_7""], ""reference_answer"": ""Decentralization eliminates the need for gatekeepers and single points of failure. It distributes power and control across a network, enhances security, and promotes transparency without central authority.""}",opt-v3-forced-search-f9c11837,1,"{""answer"": ""Decentralization in blockchain involves distributing power and control across a network rather than concentrating it in a single entity. This enhances security and promotes transparency by eliminating central points of failure or control, as seen with Bitcoin where transactions are verified by a global network of nodes instead of a central authority."", ""retrieved_chunks"": [""Blockchain_For_Beginners_A_EUBOF_Guide_parent_9"", ""Blockchain_For_Beginners_A_EUBOF_Guide_parent_7"", ""Blockchain_For_Beginners_A_EUBOF_Guide_parent_10""], ""retrieved_docs"": ""- They operate on blockchain technology, which is a decentralized and dist\n\n---\n\n- Blockchain decentralization is a “paradigm shift” from centralized systems. It distributes power and control across a network, enhances security, and promotes transparency.\n- A practical example of how decentralization works on blockchain is Bitcoin (see previous section). Bitcoin is a digital currency built on blockchain. There is no central bank controlling it; instead, transactions are verified by a global network of nodes, making it decentralized.\n- When we discuss blockchain cryptography, this entails the following components:  \n  - Digital Signatures: the purpose of digital signatures is to ensure security and authenticity. To achieve this, when a user makes a transaction, they sign it with their private key (a secret code known only to them, also known as Privkey). Others can use the sender's public key (a code that everyone can see, also known as Pubkey) to verify that the transaction was indeed created by the rightful owner of the private key.\n\n---\n\n- NFTs are a type of digital asset distinct in its uniqueness and noninterchangeability with other digital tokens.\n- Each NFT is cryptographically verified for its singularity and stored on a blockchain or distributed ledger, visible to all.""}","{""inputs"": {""question"": ""What is decentralization in blockchain?""}, ""outputs"": {""answer"": ""Decentralization in blockchain involves distributing power and control across a network rather than concentrating it in a single entity. This enhances security and promotes transparency by eliminating central points of failure or control, as seen with Bitcoin where transactions are verified by a global network of nodes instead of a central authority."", ""retrieved_chunks"": [""Blockchain_For_Beginners_A_EUBOF_Guide_parent_9"", ""Blockchain_For_Beginners_A_EUBOF_Guide_parent_7"", ""Blockchain_For_Beginners_A_EUBOF_Guide_parent_10""], ""retrieved_docs"": ""- They operate on blockchain technology, which is a decentralized and dist\n\n---\n\n- Blockchain decentralization is a “paradigm shift” from centralized systems. It distributes power and control across a network, enhances security, and promotes transparency.\n- A practical example of how decentralization works on blockchain is Bitcoin (see previous section). Bitcoin is a digital currency built on blockchain. There is no central bank controlling it; instead, transactions are verified by a global network of nodes, making it decentralized.\n- When we discuss blockchain cryptography, this entails the following components:  \n  - Digital Signatures: the purpose of digital signatures is to ensure security and authenticity. To achieve this, when a user makes a transaction, they sign it with their private key (a secret code known only to them, also known as Privkey). Others can use the sender's public key (a code that everyone can see, also known as Pubkey) to verify that the transaction was indeed created by the rightful owner of the private key.\n\n---\n\n- NFTs are a type of digital asset distinct in its uniqueness and noninterchangeability with other digital tokens.\n- Each NFT is cryptographically verified for its singularity and stored on a blockchain or distributed ledger, visible to all.""}, ""session_id"": ""2f73e6dd-8a77-431f-8ca4-49a3a00f954a"", ""error"": null, ""extra"": {""metadata"": {""__ls_runner"": ""py_sdk_evaluate"", ""description"": ""Graph-enforced search - structurally impossible to skip search"", ""example_version"": ""2026-01-18T13:28:07.164161+00:00"", ""experiment_id"": ""opt-v3-forced-search"", ""experiment_name"": ""Optimized V3 (Forced Search)"", ""ls_example_category"": ""blockchain"", ""ls_example_dataset_split"": [""base""], ""ls_example_difficulty"": ""easy"", ""ls_example_question_type"": ""factual"", ""ls_example_test_id"": ""bc-003-decentralization"", ""ls_method"": ""traceable"", ""ls_run_depth"": 0, ""num_repetitions"": 1, ""revision_id"": ""ad71701-dirty"", ""version"": ""1.0""}, ""runtime"": {""langchain_core_version"": ""1.2.7"", ""langchain_version"": ""1.2.4"", ""library"": ""langsmith"", ""platform"": ""macOS-26.1-arm64-arm-64bit"", ""py_implementation"": ""CPython"", ""runtime"": ""python"", ""runtime_version"": ""3.11.14"", ""sdk"": ""langsmith-py"", ""sdk_version"": ""0.6.4""}}, ""run_type"": ""chain"", ""id"": ""019bd490-abda-7241-aa13-835eba1d97a5"", ""status"": ""success""}",success,,27.3722,2925,,1.0,0.8,27.3722,0.7,0.8233
