id,inputs,reference_outputs,session_name,repetition,outputs,run,status,error,latency,tokens,total_cost,answer_quality,faithfulness,latency,retrieval_relevance,semantic_similarity
a50f7b2f-ef6e-4b29-b50d-8fda84c7fed7,"{""question"": ""How do I enable JavaScript in Chrome?""}","{""test_id"": ""js-006-enable-chrome"", ""category"": ""javascript"", ""difficulty"": ""medium"", ""question_type"": ""factual"", ""expected_chunks"": [""javascript_tutorial_parent_18""], ""reference_answer"": ""In Chrome: Click Chrome menu > Settings > Show advanced settings > Privacy section > Content settings > JavaScript section > Select 'Allow all sites to run JavaScript'.""}",opt-v3-forced-search-f9c11837,1,"{""answer"": ""Click the Chrome menu at the top right hand corner of your browser. Select **Settings**. Click **Show advanced settings** at the end of the page. Under the **Privacy** section, click the Content settings button. In the \""Javascript\"" section, select \""Allow all sites to run JavaScript (recommended)\""."", ""retrieved_chunks"": [""javascript_tutorial_parent_4"", ""javascript_tutorial_parent_15"", ""javascript_tutorial_parent_18"", ""javascript_tutorial_parent_17""], ""retrieved_docs"": ""## **Table of Contents**  \nAbout the Tutorial .............................................................................................................................................\nAudience ..........................................................................................................\n\n---\n\n- All the modern browsers come with built-in support for JavaScript. Frequently, you\n  may need to enable or disable this support manually. This chapter explains the\n  procedure of enabling and disabling JavaScript support in your browsers: Internet\n  Explorer, Firefox, chrome, and Opera.\n\n---\n\n- Click the Chrome menu at the top right hand corner of your browser.\n- Select **Settings** .\n- Click **Show advanced settings** at the end of the page.\n- Under the **Privacy** section, click the Content settings button.\n- In the \""Javascript\"" section, select \""Do not allow any site to run JavaScript\""\nor \""Allow all sites to run JavaScript (recommended)\"".\n\n---\n\n- Open a new tab -> type **about: config** in the address bar.\n- Then you will find the warning dialog. Select **I’ll be careful, I promise!**\n- In the search bar, type **javascript.enabled** .\n- There you will find the option to enable or disable javascript by right-clicking\non the value of that option -> **select toggle** .""}","{""inputs"": {""question"": ""How do I enable JavaScript in Chrome?""}, ""outputs"": {""answer"": ""Click the Chrome menu at the top right hand corner of your browser. Select **Settings**. Click **Show advanced settings** at the end of the page. Under the **Privacy** section, click the Content settings button. In the \""Javascript\"" section, select \""Allow all sites to run JavaScript (recommended)\""."", ""retrieved_chunks"": [""javascript_tutorial_parent_4"", ""javascript_tutorial_parent_15"", ""javascript_tutorial_parent_18"", ""javascript_tutorial_parent_17""], ""retrieved_docs"": ""## **Table of Contents**  \nAbout the Tutorial .............................................................................................................................................\nAudience ..........................................................................................................\n\n---\n\n- All the modern browsers come with built-in support for JavaScript. Frequently, you\n  may need to enable or disable this support manually. This chapter explains the\n  procedure of enabling and disabling JavaScript support in your browsers: Internet\n  Explorer, Firefox, chrome, and Opera.\n\n---\n\n- Click the Chrome menu at the top right hand corner of your browser.\n- Select **Settings** .\n- Click **Show advanced settings** at the end of the page.\n- Under the **Privacy** section, click the Content settings button.\n- In the \""Javascript\"" section, select \""Do not allow any site to run JavaScript\""\nor \""Allow all sites to run JavaScript (recommended)\"".\n\n---\n\n- Open a new tab -> type **about: config** in the address bar.\n- Then you will find the warning dialog. Select **I’ll be careful, I promise!**\n- In the search bar, type **javascript.enabled** .\n- There you will find the option to enable or disable javascript by right-clicking\non the value of that option -> **select toggle** .""}, ""session_id"": ""2f73e6dd-8a77-431f-8ca4-49a3a00f954a"", ""error"": null, ""extra"": {""metadata"": {""__ls_runner"": ""py_sdk_evaluate"", ""description"": ""Graph-enforced search - structurally impossible to skip search"", ""example_version"": ""2026-01-18T13:28:04.300087+00:00"", ""experiment_id"": ""opt-v3-forced-search"", ""experiment_name"": ""Optimized V3 (Forced Search)"", ""ls_example_category"": ""javascript"", ""ls_example_dataset_split"": [""base""], ""ls_example_difficulty"": ""medium"", ""ls_example_question_type"": ""factual"", ""ls_example_test_id"": ""js-006-enable-chrome"", ""ls_method"": ""traceable"", ""ls_run_depth"": 0, ""num_repetitions"": 1, ""revision_id"": ""ad71701-dirty"", ""version"": ""1.0""}, ""runtime"": {""langchain_core_version"": ""1.2.7"", ""langchain_version"": ""1.2.4"", ""library"": ""langsmith"", ""platform"": ""macOS-26.1-arm64-arm-64bit"", ""py_implementation"": ""CPython"", ""runtime"": ""python"", ""runtime_version"": ""3.11.14"", ""sdk"": ""langsmith-py"", ""sdk_version"": ""0.6.4""}}, ""run_type"": ""chain"", ""id"": ""019bd493-874f-7c70-90ff-9911de6c373a"", ""status"": ""success""}",success,,90.2188,6960,,1.0,0.5,90.2188,0.7,0.9539
a567c48a-426f-459f-984f-63f16a2bd15a,"{""question"": ""What are CBDCs and how do they differ from cryptocurrencies?""}","{""test_id"": ""bc-010-cbdc"", ""category"": ""blockchain"", ""difficulty"": ""hard"", ""question_type"": ""comparison"", ""expected_chunks"": [""Blockchain_For_Beginners_A_EUBOF_Guide_parent_10""], ""reference_answer"": ""CBDCs (Central Bank Digital Currencies) are digital money issued by central banks, representing a claim against the issuing bank. Unlike decentralized cryptocurrencies like Bitcoin, CBDCs are centralized and controlled by central banks.""}",opt-v3-forced-search-f9c11837,1,"{""answer"": ""CBDCs are a form of digital money issued by a central bank. They differ from cryptocurrencies in that cryptocurrencies exist independently of any central authority and operate on blockchain technology, whereas CBDCs are backed by a central bank."", ""retrieved_chunks"": [""Blockchain_For_Beginners_A_EUBOF_Guide_parent_9"", ""Blockchain_For_Beginners_A_EUBOF_Guide_parent_10"", ""Blockchain_For_Beginners_A_EUBOF_Guide_parent_5""], ""retrieved_docs"": ""- Cryptocurrencies exist only in digital form, and they are not physically tangible like traditional money (e.g., cash or coins). They are stored in digital wallets, which can be software-based or hardware-based.  \n- They operate on blockchain technology, which is a decentralized and dist\n\n---\n\n- NFTs are a type of digital asset distinct in its uniqueness and noninterchangeability with other digital tokens.\n- The first major NFT project, CryptoPunks, featured 10,000 unique digital characters.\n\n---\n\n- CBDC: A Central Bank Digital Currency is a form of digital money, issued by a central bank.\n- NONE""}","{""inputs"": {""question"": ""What are CBDCs and how do they differ from cryptocurrencies?""}, ""outputs"": {""answer"": ""CBDCs are a form of digital money issued by a central bank. They differ from cryptocurrencies in that cryptocurrencies exist independently of any central authority and operate on blockchain technology, whereas CBDCs are backed by a central bank."", ""retrieved_chunks"": [""Blockchain_For_Beginners_A_EUBOF_Guide_parent_9"", ""Blockchain_For_Beginners_A_EUBOF_Guide_parent_10"", ""Blockchain_For_Beginners_A_EUBOF_Guide_parent_5""], ""retrieved_docs"": ""- Cryptocurrencies exist only in digital form, and they are not physically tangible like traditional money (e.g., cash or coins). They are stored in digital wallets, which can be software-based or hardware-based.  \n- They operate on blockchain technology, which is a decentralized and dist\n\n---\n\n- NFTs are a type of digital asset distinct in its uniqueness and noninterchangeability with other digital tokens.\n- The first major NFT project, CryptoPunks, featured 10,000 unique digital characters.\n\n---\n\n- CBDC: A Central Bank Digital Currency is a form of digital money, issued by a central bank.\n- NONE""}, ""session_id"": ""2f73e6dd-8a77-431f-8ca4-49a3a00f954a"", ""error"": null, ""extra"": {""metadata"": {""__ls_runner"": ""py_sdk_evaluate"", ""description"": ""Graph-enforced search - structurally impossible to skip search"", ""example_version"": ""2026-01-18T13:28:10.539983+00:00"", ""experiment_id"": ""opt-v3-forced-search"", ""experiment_name"": ""Optimized V3 (Forced Search)"", ""ls_example_category"": ""blockchain"", ""ls_example_dataset_split"": [""base""], ""ls_example_difficulty"": ""hard"", ""ls_example_question_type"": ""comparison"", ""ls_example_test_id"": ""bc-010-cbdc"", ""ls_method"": ""traceable"", ""ls_run_depth"": 0, ""num_repetitions"": 1, ""revision_id"": ""ad71701-dirty"", ""version"": ""1.0""}, ""runtime"": {""langchain_core_version"": ""1.2.7"", ""langchain_version"": ""1.2.4"", ""library"": ""langsmith"", ""platform"": ""macOS-26.1-arm64-arm-64bit"", ""py_implementation"": ""CPython"", ""runtime"": ""python"", ""runtime_version"": ""3.11.14"", ""sdk"": ""langsmith-py"", ""sdk_version"": ""0.6.4""}}, ""run_type"": ""chain"", ""id"": ""019bd48d-6759-7be0-925e-6acb4692227c"", ""status"": ""success""}",success,,36.6065,4342,,1.0,0.8,36.6065,0.7,0.9548
a5842d4b-8955-4ecd-bdcb-202c733c43d8,"{""question"": ""What is blockchain?""}","{""test_id"": ""bc-001-what-is-blockchain"", ""category"": ""blockchain"", ""difficulty"": ""easy"", ""question_type"": ""factual"", ""expected_chunks"": [""Blockchain_For_Beginners_A_EUBOF_Guide_parent_5"", ""Blockchain_For_Beginners_A_EUBOF_Guide_parent_6""], ""reference_answer"": ""Blockchain is a tamper-proof, shared digital ledger that records transactions in a decentralized peer-to-peer network. It permanently stores the history of asset exchanges between participants in the network.""}",opt-v3-forced-search-f9c11837,1,"{""answer"": ""Blockchain is a tamper-proof, shared digital ledger that records transactions in a decentralized peer-to-peer network. It is poised to revolutionize our world by democratizing the exchange of value and trust."", ""retrieved_chunks"": [""Blockchain_For_Beginners_A_EUBOF_Guide_parent_5"", ""Blockchain_For_Beginners_A_EUBOF_Guide_parent_6"", ""Blockchain_For_Beginners_A_EUBOF_Guide_parent_13""], ""retrieved_docs"": ""- Blockchain is a shared, immutable ledger for recording transactions, tracking assets, and building trust.\n- The Byzantine Generals’ Problem. Available at:\nhttps://www.andrew.cmu.edu/course/15-749/READINGS/required/resilience/lamport82.pdf\n\n---\n\n- Blockchain is poised to revolutionize our world by democratizing the exchange of value and trust.\n- While it may start with\n\n---\n\n- Blockchain: A tamper-proof, shared digital ledger that records transactions in a decentralized peer-to-peer network.\n- Cryptography: A set of techniques and algorithms that ensure the security and integrity of data stored and transmitted on a blockchain network.""}","{""inputs"": {""question"": ""What is blockchain?""}, ""outputs"": {""answer"": ""Blockchain is a tamper-proof, shared digital ledger that records transactions in a decentralized peer-to-peer network. It is poised to revolutionize our world by democratizing the exchange of value and trust."", ""retrieved_chunks"": [""Blockchain_For_Beginners_A_EUBOF_Guide_parent_5"", ""Blockchain_For_Beginners_A_EUBOF_Guide_parent_6"", ""Blockchain_For_Beginners_A_EUBOF_Guide_parent_13""], ""retrieved_docs"": ""- Blockchain is a shared, immutable ledger for recording transactions, tracking assets, and building trust.\n- The Byzantine Generals’ Problem. Available at:\nhttps://www.andrew.cmu.edu/course/15-749/READINGS/required/resilience/lamport82.pdf\n\n---\n\n- Blockchain is poised to revolutionize our world by democratizing the exchange of value and trust.\n- While it may start with\n\n---\n\n- Blockchain: A tamper-proof, shared digital ledger that records transactions in a decentralized peer-to-peer network.\n- Cryptography: A set of techniques and algorithms that ensure the security and integrity of data stored and transmitted on a blockchain network.""}, ""session_id"": ""2f73e6dd-8a77-431f-8ca4-49a3a00f954a"", ""error"": null, ""extra"": {""metadata"": {""__ls_runner"": ""py_sdk_evaluate"", ""description"": ""Graph-enforced search - structurally impossible to skip search"", ""example_version"": ""2026-01-18T13:28:05.633478+00:00"", ""experiment_id"": ""opt-v3-forced-search"", ""experiment_name"": ""Optimized V3 (Forced Search)"", ""ls_example_category"": ""blockchain"", ""ls_example_dataset_split"": [""base""], ""ls_example_difficulty"": ""easy"", ""ls_example_question_type"": ""factual"", ""ls_example_test_id"": ""bc-001-what-is-blockchain"", ""ls_method"": ""traceable"", ""ls_run_depth"": 0, ""num_repetitions"": 1, ""revision_id"": ""ad71701-dirty"", ""version"": ""1.0""}, ""runtime"": {""langchain_core_version"": ""1.2.7"", ""langchain_version"": ""1.2.4"", ""library"": ""langsmith"", ""platform"": ""macOS-26.1-arm64-arm-64bit"", ""py_implementation"": ""CPython"", ""runtime"": ""python"", ""runtime_version"": ""3.11.14"", ""sdk"": ""langsmith-py"", ""sdk_version"": ""0.6.4""}}, ""run_type"": ""chain"", ""id"": ""019bd491-7221-76a0-afe2-2ea541af8a8e"", ""status"": ""success""}",success,,22.0049,2623,,1.0,0.8,22.0049,0.7,0.9607
ac841b09-d74b-4c90-a980-baf66dc5b195,"{""question"": ""What are NFTs?""}","{""test_id"": ""bc-007-nfts"", ""category"": ""blockchain"", ""difficulty"": ""medium"", ""question_type"": ""factual"", ""expected_chunks"": [""Blockchain_For_Beginners_A_EUBOF_Guide_parent_10""], ""reference_answer"": ""NFTs (Non-Fungible Tokens) are unique digital assets that are non-interchangeable, cryptographically verified, and stored on blockchain. Key features include uniqueness, rarity, proof of ownership, immutability, and programmability.""}",opt-v3-forced-search-f9c11837,1,"{""answer"": ""NFTs are unique digital assets that exist on a blockchain and represent ownership of a particular asset."", ""retrieved_chunks"": [""Blockchain_For_Beginners_A_EUBOF_Guide_parent_10"", ""Blockchain_For_Beginners_A_EUBOF_Guide_parent_5""], ""retrieved_docs"": ""- NFTs are a type of digital asset distinct in its uniqueness and noninterchangeability with other digital tokens.\n- The history of NFTs has evolved from basic digital collectibles to complex asset ownership models.\n\n---\n\n- **NFTs:** Non-fungible tokens are unique digital assets that exist on a blockchain and represent ownership of a particular asset.\n- NONE""}","{""inputs"": {""question"": ""What are NFTs?""}, ""outputs"": {""answer"": ""NFTs are unique digital assets that exist on a blockchain and represent ownership of a particular asset."", ""retrieved_chunks"": [""Blockchain_For_Beginners_A_EUBOF_Guide_parent_10"", ""Blockchain_For_Beginners_A_EUBOF_Guide_parent_5""], ""retrieved_docs"": ""- NFTs are a type of digital asset distinct in its uniqueness and noninterchangeability with other digital tokens.\n- The history of NFTs has evolved from basic digital collectibles to complex asset ownership models.\n\n---\n\n- **NFTs:** Non-fungible tokens are unique digital assets that exist on a blockchain and represent ownership of a particular asset.\n- NONE""}, ""session_id"": ""2f73e6dd-8a77-431f-8ca4-49a3a00f954a"", ""error"": null, ""extra"": {""metadata"": {""__ls_runner"": ""py_sdk_evaluate"", ""description"": ""Graph-enforced search - structurally impossible to skip search"", ""example_version"": ""2026-01-18T13:28:09.315485+00:00"", ""experiment_id"": ""opt-v3-forced-search"", ""experiment_name"": ""Optimized V3 (Forced Search)"", ""ls_example_category"": ""blockchain"", ""ls_example_dataset_split"": [""base""], ""ls_example_difficulty"": ""medium"", ""ls_example_question_type"": ""factual"", ""ls_example_test_id"": ""bc-007-nfts"", ""ls_method"": ""traceable"", ""ls_run_depth"": 0, ""num_repetitions"": 1, ""revision_id"": ""ad71701-dirty"", ""version"": ""1.0""}, ""runtime"": {""langchain_core_version"": ""1.2.7"", ""langchain_version"": ""1.2.4"", ""library"": ""langsmith"", ""platform"": ""macOS-26.1-arm64-arm-64bit"", ""py_implementation"": ""CPython"", ""runtime"": ""python"", ""runtime_version"": ""3.11.14"", ""sdk"": ""langsmith-py"", ""sdk_version"": ""0.6.4""}}, ""run_type"": ""chain"", ""id"": ""019bd48e-a921-7192-9488-5fe6cc38053d"", ""status"": ""success""}",success,,13.5389,1762,,0.8,0.8,13.5389,0.7,0.8899
b3ade612-417b-48a1-855e-b2accad205e4,"{""question"": ""What is Bitcoin?""}","{""test_id"": ""bc-002-what-is-bitcoin"", ""category"": ""blockchain"", ""difficulty"": ""easy"", ""question_type"": ""factual"", ""expected_chunks"": [""Blockchain_For_Beginners_A_EUBOF_Guide_parent_5"", ""Blockchain_For_Beginners_A_EUBOF_Guide_parent_6""], ""reference_answer"": ""Bitcoin is the first and most renowned cryptocurrency, representing the first application of blockchain technology in financial services. It was created by Satoshi Nakamoto in 2009.""}",opt-v3-forced-search-f9c11837,1,"{""answer"": ""Bitcoin is a cryptocurrency and the first and most renowned application of blockchain technology, specifically within financial services."", ""retrieved_chunks"": [""Blockchain_For_Beginners_A_EUBOF_Guide_parent_6"", ""Blockchain_For_Beginners_A_EUBOF_Guide_parent_5""], ""retrieved_docs"": ""- Bitcoin is a notable example of blockchain networks which eases trustless financial transactions.\n\n---\n\n- Bitcoin:** A cryptocurrency, the first and most renowned application (use case) of blockchain technology,\nspecifically within financial services.""}","{""inputs"": {""question"": ""What is Bitcoin?""}, ""outputs"": {""answer"": ""Bitcoin is a cryptocurrency and the first and most renowned application of blockchain technology, specifically within financial services."", ""retrieved_chunks"": [""Blockchain_For_Beginners_A_EUBOF_Guide_parent_6"", ""Blockchain_For_Beginners_A_EUBOF_Guide_parent_5""], ""retrieved_docs"": ""- Bitcoin is a notable example of blockchain networks which eases trustless financial transactions.\n\n---\n\n- Bitcoin:** A cryptocurrency, the first and most renowned application (use case) of blockchain technology,\nspecifically within financial services.""}, ""session_id"": ""2f73e6dd-8a77-431f-8ca4-49a3a00f954a"", ""error"": null, ""extra"": {""metadata"": {""__ls_runner"": ""py_sdk_evaluate"", ""description"": ""Graph-enforced search - structurally impossible to skip search"", ""example_version"": ""2026-01-18T13:28:06.034959+00:00"", ""experiment_id"": ""opt-v3-forced-search"", ""experiment_name"": ""Optimized V3 (Forced Search)"", ""ls_example_category"": ""blockchain"", ""ls_example_dataset_split"": [""base""], ""ls_example_difficulty"": ""easy"", ""ls_example_question_type"": ""factual"", ""ls_example_test_id"": ""bc-002-what-is-bitcoin"", ""ls_method"": ""traceable"", ""ls_run_depth"": 0, ""num_repetitions"": 1, ""revision_id"": ""ad71701-dirty"", ""version"": ""1.0""}, ""runtime"": {""langchain_core_version"": ""1.2.7"", ""langchain_version"": ""1.2.4"", ""library"": ""langsmith"", ""platform"": ""macOS-26.1-arm64-arm-64bit"", ""py_implementation"": ""CPython"", ""runtime"": ""python"", ""runtime_version"": ""3.11.14"", ""sdk"": ""langsmith-py"", ""sdk_version"": ""0.6.4""}}, ""run_type"": ""chain"", ""id"": ""019bd491-3440-7343-8e90-99e357714b10"", ""status"": ""success""}",success,,12.4031,1583,,0.8,1.0,12.4031,0.7,0.8232
b69db631-ab2c-48ff-9dfc-eeb050861251,"{""question"": ""How do comments work in JavaScript?""}","{""test_id"": ""js-005-comments"", ""category"": ""javascript"", ""difficulty"": ""medium"", ""question_type"": ""conceptual"", ""expected_chunks"": [""javascript_tutorial_parent_15""], ""reference_answer"": ""JavaScript supports single-line comments with // and multi-line comments with /* */. It also recognizes HTML comment opening <!-- but requires //-- for closing.""}",opt-v3-forced-search-f9c11837,1,"{""answer"": ""Any text between a // and the end of a line is treated as a comment and ignored by JavaScript. The HTML comment opening sequence <!-- is treated as a single-line comment by JavaScript just like //, but the closing sequence --> should be written as //--> to avoid confusion."", ""retrieved_chunks"": [""javascript_tutorial_parent_12"", ""javascript_tutorial_parent_15""], ""retrieved_docs"": ""- The script tag alerts the browser program to start interpreting all the text between these tags as a script.\n- A simple syntax of your JavaScript will appear as follows.\n- The script tag takes two important attributes:\n- Your JavaScript syntax will look as follows.\n- This function can be used to write text, HTML, or both.\n\n---\n\n- Any text between a // and the end of a line is treated as a comment and is\nignored by JavaScript.\n- The HTML comment opening sequence <!--. JavaScript treats this as a single-line comment, just as it does the // comment.\n- The HTML comment closing sequence --> is not recognized by JavaScript so it\nshould be written as //-->.""}","{""inputs"": {""question"": ""How do comments work in JavaScript?""}, ""outputs"": {""answer"": ""Any text between a // and the end of a line is treated as a comment and ignored by JavaScript. The HTML comment opening sequence <!-- is treated as a single-line comment by JavaScript just like //, but the closing sequence --> should be written as //--> to avoid confusion."", ""retrieved_chunks"": [""javascript_tutorial_parent_12"", ""javascript_tutorial_parent_15""], ""retrieved_docs"": ""- The script tag alerts the browser program to start interpreting all the text between these tags as a script.\n- A simple syntax of your JavaScript will appear as follows.\n- The script tag takes two important attributes:\n- Your JavaScript syntax will look as follows.\n- This function can be used to write text, HTML, or both.\n\n---\n\n- Any text between a // and the end of a line is treated as a comment and is\nignored by JavaScript.\n- The HTML comment opening sequence <!--. JavaScript treats this as a single-line comment, just as it does the // comment.\n- The HTML comment closing sequence --> is not recognized by JavaScript so it\nshould be written as //-->.""}, ""session_id"": ""2f73e6dd-8a77-431f-8ca4-49a3a00f954a"", ""error"": null, ""extra"": {""metadata"": {""__ls_runner"": ""py_sdk_evaluate"", ""description"": ""Graph-enforced search - structurally impossible to skip search"", ""example_version"": ""2026-01-18T13:28:03.692636+00:00"", ""experiment_id"": ""opt-v3-forced-search"", ""experiment_name"": ""Optimized V3 (Forced Search)"", ""ls_example_category"": ""javascript"", ""ls_example_dataset_split"": [""base""], ""ls_example_difficulty"": ""medium"", ""ls_example_question_type"": ""conceptual"", ""ls_example_test_id"": ""js-005-comments"", ""ls_method"": ""traceable"", ""ls_run_depth"": 0, ""num_repetitions"": 1, ""revision_id"": ""ad71701-dirty"", ""version"": ""1.0""}, ""runtime"": {""langchain_core_version"": ""1.2.7"", ""langchain_version"": ""1.2.4"", ""library"": ""langsmith"", ""platform"": ""macOS-26.1-arm64-arm-64bit"", ""py_implementation"": ""CPython"", ""runtime"": ""python"", ""runtime_version"": ""3.11.14"", ""sdk"": ""langsmith-py"", ""sdk_version"": ""0.6.4""}}, ""run_type"": ""chain"", ""id"": ""019bd495-07e6-7b40-bc38-e104fa277b36"", ""status"": ""success""}",success,,23.1107,1910,,1.0,0.8,23.1107,0.7,0.8256
