id,inputs,reference_outputs,session_name,repetition,outputs,run,status,error,latency,tokens,total_cost,answer_quality,faithfulness,latency,retrieval_relevance,semantic_similarity
2e36e612-8f5d-40ad-a811-79b9944bb704,"{""question"": ""How do I install it?""}","{""test_id"": ""js-007-install-followup"", ""category"": ""javascript"", ""difficulty"": ""hard"", ""question_type"": ""follow-up"", ""expected_chunks"": [""javascript_tutorial_parent_10"", ""javascript_tutorial_parent_6""], ""reference_answer"": ""JavaScript doesn't require installation as it runs in web browsers. You only need a text editor to write code and a browser to run it.""}",opt-v3-forced-search-f9c11837,1,"{""answer"": ""The documents don't contain this information."", ""retrieved_chunks"": [""javascript_tutorial_parent_4"", ""javascript_tutorial_parent_20"", ""Blockchain_For_Beginners_A_EUBOF_Guide_parent_4"", ""javascript_tutorial_parent_25""], ""retrieved_docs"": ""## **Table of Contents**  \nAbout the Tutorial .............................................................................................................................................\nAudience ..........................................................................................................\n\n---\n\n## **Warning for Non-JavaScript Browsers**  \nIf you have to do something important using JavaScript, then you can display a\nwarning message to the user using **<noscript>** tags.  \nYou can add a **noscript** block immediately after the script block as follows:  \n```\n<html>\n\n<body>\n\n<script language=...\n\n---\n\n### **Blockchain for beginners**  \n**ABOUT THIS GUIDE.............................................................................................................................................. 2**  \n**A-Z GLOSSARY OF BLOCKCHAIN TERMS ..................................................................\n\n---\n\n## **Assignment Operators**  \n```\n\nJavaScript supports the following assignment operators:\n\n\n\n\n\n\n|S.No|Operator and Description|\n|---|---|\n|1|**= (Simple Assignment )**<br>Assigns values from the right side operand to the left side operand|\n\n\n\n**41**\n\n\n|Col1|Ex: C = A + B will assign the value of A ...""}","{""inputs"": {""question"": ""How do I install it?""}, ""outputs"": {""answer"": ""The documents don't contain this information."", ""retrieved_chunks"": [""javascript_tutorial_parent_4"", ""javascript_tutorial_parent_20"", ""Blockchain_For_Beginners_A_EUBOF_Guide_parent_4"", ""javascript_tutorial_parent_25""], ""retrieved_docs"": ""## **Table of Contents**  \nAbout the Tutorial .............................................................................................................................................\nAudience ..........................................................................................................\n\n---\n\n## **Warning for Non-JavaScript Browsers**  \nIf you have to do something important using JavaScript, then you can display a\nwarning message to the user using **<noscript>** tags.  \nYou can add a **noscript** block immediately after the script block as follows:  \n```\n<html>\n\n<body>\n\n<script language=...\n\n---\n\n### **Blockchain for beginners**  \n**ABOUT THIS GUIDE.............................................................................................................................................. 2**  \n**A-Z GLOSSARY OF BLOCKCHAIN TERMS ..................................................................\n\n---\n\n## **Assignment Operators**  \n```\n\nJavaScript supports the following assignment operators:\n\n\n\n\n\n\n|S.No|Operator and Description|\n|---|---|\n|1|**= (Simple Assignment )**<br>Assigns values from the right side operand to the left side operand|\n\n\n\n**41**\n\n\n|Col1|Ex: C = A + B will assign the value of A ...""}, ""session_id"": ""2f73e6dd-8a77-431f-8ca4-49a3a00f954a"", ""error"": null, ""extra"": {""metadata"": {""__ls_runner"": ""py_sdk_evaluate"", ""description"": ""Graph-enforced search - structurally impossible to skip search"", ""example_version"": ""2026-01-18T13:28:04.689778+00:00"", ""experiment_id"": ""opt-v3-forced-search"", ""experiment_name"": ""Optimized V3 (Forced Search)"", ""ls_example_category"": ""javascript"", ""ls_example_dataset_split"": [""base""], ""ls_example_difficulty"": ""hard"", ""ls_example_question_type"": ""follow-up"", ""ls_example_test_id"": ""js-007-install-followup"", ""ls_method"": ""traceable"", ""ls_run_depth"": 0, ""num_repetitions"": 1, ""revision_id"": ""ad71701-dirty"", ""version"": ""1.0""}, ""runtime"": {""langchain_core_version"": ""1.2.7"", ""langchain_version"": ""1.2.4"", ""library"": ""langsmith"", ""platform"": ""macOS-26.1-arm64-arm-64bit"", ""py_implementation"": ""CPython"", ""runtime"": ""python"", ""runtime_version"": ""3.11.14"", ""sdk"": ""langsmith-py"", ""sdk_version"": ""0.6.4""}}, ""run_type"": ""chain"", ""id"": ""019bd492-d7c7-7f81-8d06-07c550dbc2f7"", ""status"": ""success""}",success,,39.3969,6167,,0.4,0.0,39.3969,0.3,-0.0174
2f72454d-8d96-4fa0-9387-f95e37a4edd0,"{""question"": ""When should I use blockchain instead of a traditional database?""}","{""test_id"": ""bc-011-when-to-use"", ""category"": ""blockchain"", ""difficulty"": ""hard"", ""question_type"": ""conceptual"", ""expected_chunks"": [""Blockchain_For_Beginners_A_EUBOF_Guide_parent_7""], ""reference_answer"": ""Use blockchain when you need: immutable/tamper-proof records, decentralization without central authority, transparency and auditability, smart contracts, cryptographic security, cross-organizational trust, or cryptocurrency management.""}",opt-v3-forced-search-f9c11837,1,"{""answer"": ""Blockchain should be used when there is a need for secure, peer-to-peer interactions among parties who do not know or inherently trust one another. It is particularly suitable for applications like supply chain and healthcare where trust and security are paramount."", ""retrieved_chunks"": [""Blockchain_For_Beginners_A_EUBOF_Guide_parent_7"", ""Blockchain_For_Beginners_A_EUBOF_Guide_parent_6""], ""retrieved_docs"": ""- Blockchain should be used when trust and security are paramount in applications such as supply chain, healthcare, and more.\n- A practical example of decentralization on blockchain is Bitcoin, where transactions are verified by a global network of nodes instead of a central bank.\n\n---\n\n- Blockchain should be used when there is a need for secure, peer-to-peer interactions among parties who do not know or inherently trust one another.\n- NONE""}","{""inputs"": {""question"": ""When should I use blockchain instead of a traditional database?""}, ""outputs"": {""answer"": ""Blockchain should be used when there is a need for secure, peer-to-peer interactions among parties who do not know or inherently trust one another. It is particularly suitable for applications like supply chain and healthcare where trust and security are paramount."", ""retrieved_chunks"": [""Blockchain_For_Beginners_A_EUBOF_Guide_parent_7"", ""Blockchain_For_Beginners_A_EUBOF_Guide_parent_6""], ""retrieved_docs"": ""- Blockchain should be used when trust and security are paramount in applications such as supply chain, healthcare, and more.\n- A practical example of decentralization on blockchain is Bitcoin, where transactions are verified by a global network of nodes instead of a central bank.\n\n---\n\n- Blockchain should be used when there is a need for secure, peer-to-peer interactions among parties who do not know or inherently trust one another.\n- NONE""}, ""session_id"": ""2f73e6dd-8a77-431f-8ca4-49a3a00f954a"", ""error"": null, ""extra"": {""metadata"": {""__ls_runner"": ""py_sdk_evaluate"", ""description"": ""Graph-enforced search - structurally impossible to skip search"", ""example_version"": ""2026-01-18T13:28:10.957255+00:00"", ""experiment_id"": ""opt-v3-forced-search"", ""experiment_name"": ""Optimized V3 (Forced Search)"", ""ls_example_category"": ""blockchain"", ""ls_example_dataset_split"": [""base""], ""ls_example_difficulty"": ""hard"", ""ls_example_question_type"": ""conceptual"", ""ls_example_test_id"": ""bc-011-when-to-use"", ""ls_method"": ""traceable"", ""ls_run_depth"": 0, ""num_repetitions"": 1, ""revision_id"": ""ad71701-dirty"", ""version"": ""1.0""}, ""runtime"": {""langchain_core_version"": ""1.2.7"", ""langchain_version"": ""1.2.4"", ""library"": ""langsmith"", ""platform"": ""macOS-26.1-arm64-arm-64bit"", ""py_implementation"": ""CPython"", ""runtime"": ""python"", ""runtime_version"": ""3.11.14"", ""sdk"": ""langsmith-py"", ""sdk_version"": ""0.6.4""}}, ""run_type"": ""chain"", ""id"": ""019bd48d-1e3c-76f1-9b5e-33867d8bedd8"", ""status"": ""success""}",success,,14.8308,1833,,1.0,0.5,14.8308,0.7,0.7718
41477b96-1007-45a5-88b7-3966ea2a8c16,"{""question"": ""What is cryptography in blockchain?""}","{""test_id"": ""bc-006-cryptography"", ""category"": ""blockchain"", ""difficulty"": ""medium"", ""question_type"": ""conceptual"", ""expected_chunks"": [""Blockchain_For_Beginners_A_EUBOF_Guide_parent_7""], ""reference_answer"": ""Blockchain cryptography includes digital signatures (authenticate transactions using private/public keys), hash functions (create unique fingerprints of data for integrity), and ensures security, integrity, and decentralization of the network.""}",opt-v3-forced-search-f9c11837,1,"{""answer"": ""Cryptography in blockchain involves a set of techniques and algorithms that ensure the security and integrity of data stored and transmitted on the network. It protects the information using methods like digital signatures, which involve private and public keys for signing and verifying transactions."", ""retrieved_chunks"": [""Blockchain_For_Beginners_A_EUBOF_Guide_parent_7"", ""Blockchain_For_Beginners_A_EUBOF_Guide_parent_5"", ""Blockchain_For_Beginners_A_EUBOF_Guide_parent_13""], ""retrieved_docs"": ""- Cryptography protects the information on the blockchain.\n- Digital Signatures ensure security and authenticity by using a private key for signing transactions and a public key for verification.\n\n---\n\n- Cryptography: A set of techniques and algorithms that ensure the security and integrity of data stored and transmitted on a blockchain network.\n- Hash Function: A mathematical function commonly used to verify the integrity of data, by transforming identical data to a u\n\n---\n\n- **Blockchain for beginners**  \nLamport, L., Shostak, R., and Pease, M. (1982). The Byzantine Generals’ Problem. Available at:\nhttps://www.andrew.cmu.edu/course/15-749/READINGS/required/resilience/lamport82.pdf (Accessed: 30/11/2023).\n- **On public and private blockchains**  \nIBM Blockchain Blog. (2017). The difference between public and private blockchain. Available at:\nhttps://www.ibm.com/blogs/blockchain/2017/05/the-difference-between-public-and-private-blockchain/\n(Accessed: 30/11/2023).""}","{""inputs"": {""question"": ""What is cryptography in blockchain?""}, ""outputs"": {""answer"": ""Cryptography in blockchain involves a set of techniques and algorithms that ensure the security and integrity of data stored and transmitted on the network. It protects the information using methods like digital signatures, which involve private and public keys for signing and verifying transactions."", ""retrieved_chunks"": [""Blockchain_For_Beginners_A_EUBOF_Guide_parent_7"", ""Blockchain_For_Beginners_A_EUBOF_Guide_parent_5"", ""Blockchain_For_Beginners_A_EUBOF_Guide_parent_13""], ""retrieved_docs"": ""- Cryptography protects the information on the blockchain.\n- Digital Signatures ensure security and authenticity by using a private key for signing transactions and a public key for verification.\n\n---\n\n- Cryptography: A set of techniques and algorithms that ensure the security and integrity of data stored and transmitted on a blockchain network.\n- Hash Function: A mathematical function commonly used to verify the integrity of data, by transforming identical data to a u\n\n---\n\n- **Blockchain for beginners**  \nLamport, L., Shostak, R., and Pease, M. (1982). The Byzantine Generals’ Problem. Available at:\nhttps://www.andrew.cmu.edu/course/15-749/READINGS/required/resilience/lamport82.pdf (Accessed: 30/11/2023).\n- **On public and private blockchains**  \nIBM Blockchain Blog. (2017). The difference between public and private blockchain. Available at:\nhttps://www.ibm.com/blogs/blockchain/2017/05/the-difference-between-public-and-private-blockchain/\n(Accessed: 30/11/2023).""}, ""session_id"": ""2f73e6dd-8a77-431f-8ca4-49a3a00f954a"", ""error"": null, ""extra"": {""metadata"": {""__ls_runner"": ""py_sdk_evaluate"", ""description"": ""Graph-enforced search - structurally impossible to skip search"", ""example_version"": ""2026-01-18T13:28:08.832984+00:00"", ""experiment_id"": ""opt-v3-forced-search"", ""experiment_name"": ""Optimized V3 (Forced Search)"", ""ls_example_category"": ""blockchain"", ""ls_example_dataset_split"": [""base""], ""ls_example_difficulty"": ""medium"", ""ls_example_question_type"": ""conceptual"", ""ls_example_test_id"": ""bc-006-cryptography"", ""ls_method"": ""traceable"", ""ls_run_depth"": 0, ""num_repetitions"": 1, ""revision_id"": ""ad71701-dirty"", ""version"": ""1.0""}, ""runtime"": {""langchain_core_version"": ""1.2.7"", ""langchain_version"": ""1.2.4"", ""library"": ""langsmith"", ""platform"": ""macOS-26.1-arm64-arm-64bit"", ""py_implementation"": ""CPython"", ""runtime"": ""python"", ""runtime_version"": ""3.11.14"", ""sdk"": ""langsmith-py"", ""sdk_version"": ""0.6.4""}}, ""run_type"": ""chain"", ""id"": ""019bd48e-ebc8-7ea2-b912-bc604a38944e"", ""status"": ""success""}",success,,27.3312,3038,,1.0,0.8,27.3312,0.7,0.8883
63a324ad-d024-4646-917c-6e62af9d0283,"{""question"": ""What's the difference between JavaScript and Java?""}","{""test_id"": ""js-008-vs-java"", ""category"": ""javascript"", ""difficulty"": ""hard"", ""question_type"": ""comparison"", ""expected_chunks"": [""javascript_tutorial_parent_6""], ""reference_answer"": ""JavaScript is a lightweight, interpreted language for web pages, while Java is a full programming language. JavaScript is complementary to and integrated with Java and HTML, but they are different languages.""}",opt-v3-forced-search-f9c11837,1,"{""answer"": ""The documents don't contain this information."", ""retrieved_chunks"": [""javascript_tutorial_parent_11"", ""javascript_tutorial_parent_21"", ""javascript_tutorial_parent_13"", ""javascript_tutorial_parent_22"", ""javascript_tutorial_parent_14"", ""javascript_tutorial_parent_6"", ""javascript_tutorial_parent_0""], ""retrieved_docs"": ""- The ECMAScript Edition 5 standard will be the first update to be released in over four years. JavaScript 2.0 conforms to Edition 5 of the ECMAScript standard, and the difference between the two is extremely minor.\n- Today, Netscape's JavaScript and Microsoft's JScript conform to the ECMAScript standard, although both the languages still support the features that are not a part of the standard.\n\n---\n\n## **JavaScript in <body> and <head> Sections**  \n```\n\nYou can put your JavaScript code in <head> and <body> section altogether as\nfollows.\n\n```\n<html>  \n<head>  \n<script type=\""text/javascript\"">  \n<!-\nfunction sayHello() {  \nalert(\""Hello World\"")  \n}  \n//-->  \n</script>  \n</head>  \n<body>  \n<script t...\n\n---\n\n## **Semicolons are Optional**  \nSimple statements in JavaScript are generally followed by a semicolon character, just\nas they are in C, C++, and Java. JavaScript, however, allows you to omit this\nsemicolon if each of your statements are placed on a separate line. For example, the\nfollowing code cou...\n\n---\n\n- You should not use any of the JavaScript reserved keywords as a variable name.\n- JavaScript variable names should not start with a numeral (0-9). They must begin with a letter or an underscore character.\n\n---\n\n- JavaScript is a case-sensitive language. This means that the language keywords,\nvariables, function names, and any other identifiers must always be typed with a\nconsistent capitalization of letters.\n- So the identifiers **Time** and **TIME** will convey different meanings in JavaScript.\n\n---\n\n- JavaScript was first known as **LiveScript**, but Netscape changed its name to JavaScript, possibly because of the excitement being generated by Java.\n\n---\n\n- JavaScript is a lightweight, interpreted programming language.\n- It is designed for creating network-centric applications.\n- It is complimentary to and integrated with Java.""}","{""inputs"": {""question"": ""What's the difference between JavaScript and Java?""}, ""outputs"": {""answer"": ""The documents don't contain this information."", ""retrieved_chunks"": [""javascript_tutorial_parent_11"", ""javascript_tutorial_parent_21"", ""javascript_tutorial_parent_13"", ""javascript_tutorial_parent_22"", ""javascript_tutorial_parent_14"", ""javascript_tutorial_parent_6"", ""javascript_tutorial_parent_0""], ""retrieved_docs"": ""- The ECMAScript Edition 5 standard will be the first update to be released in over four years. JavaScript 2.0 conforms to Edition 5 of the ECMAScript standard, and the difference between the two is extremely minor.\n- Today, Netscape's JavaScript and Microsoft's JScript conform to the ECMAScript standard, although both the languages still support the features that are not a part of the standard.\n\n---\n\n## **JavaScript in <body> and <head> Sections**  \n```\n\nYou can put your JavaScript code in <head> and <body> section altogether as\nfollows.\n\n```\n<html>  \n<head>  \n<script type=\""text/javascript\"">  \n<!-\nfunction sayHello() {  \nalert(\""Hello World\"")  \n}  \n//-->  \n</script>  \n</head>  \n<body>  \n<script t...\n\n---\n\n## **Semicolons are Optional**  \nSimple statements in JavaScript are generally followed by a semicolon character, just\nas they are in C, C++, and Java. JavaScript, however, allows you to omit this\nsemicolon if each of your statements are placed on a separate line. For example, the\nfollowing code cou...\n\n---\n\n- You should not use any of the JavaScript reserved keywords as a variable name.\n- JavaScript variable names should not start with a numeral (0-9). They must begin with a letter or an underscore character.\n\n---\n\n- JavaScript is a case-sensitive language. This means that the language keywords,\nvariables, function names, and any other identifiers must always be typed with a\nconsistent capitalization of letters.\n- So the identifiers **Time** and **TIME** will convey different meanings in JavaScript.\n\n---\n\n- JavaScript was first known as **LiveScript**, but Netscape changed its name to JavaScript, possibly because of the excitement being generated by Java.\n\n---\n\n- JavaScript is a lightweight, interpreted programming language.\n- It is designed for creating network-centric applications.\n- It is complimentary to and integrated with Java.""}, ""session_id"": ""2f73e6dd-8a77-431f-8ca4-49a3a00f954a"", ""error"": null, ""extra"": {""metadata"": {""__ls_runner"": ""py_sdk_evaluate"", ""description"": ""Graph-enforced search - structurally impossible to skip search"", ""example_version"": ""2026-01-18T13:28:05.116962+00:00"", ""experiment_id"": ""opt-v3-forced-search"", ""experiment_name"": ""Optimized V3 (Forced Search)"", ""ls_example_category"": ""javascript"", ""ls_example_dataset_split"": [""base""], ""ls_example_difficulty"": ""hard"", ""ls_example_question_type"": ""comparison"", ""ls_example_test_id"": ""js-008-vs-java"", ""ls_method"": ""traceable"", ""ls_run_depth"": 0, ""num_repetitions"": 1, ""revision_id"": ""ad71701-dirty"", ""version"": ""1.0""}, ""runtime"": {""langchain_core_version"": ""1.2.7"", ""langchain_version"": ""1.2.4"", ""library"": ""langsmith"", ""platform"": ""macOS-26.1-arm64-arm-64bit"", ""py_implementation"": ""CPython"", ""runtime"": ""python"", ""runtime_version"": ""3.11.14"", ""sdk"": ""langsmith-py"", ""sdk_version"": ""0.6.4""}}, ""run_type"": ""chain"", ""id"": ""019bd491-db1b-7872-9bc3-c92c317497ce"", ""status"": ""success""}",success,,57.434,8818,,0.4,0.0,57.434,0.7,-0.0298
6e9eb40a-7a91-4d24-a849-2981644c4b14,"{""question"": ""How does mining work in blockchain?""}","{""test_id"": ""bc-004-mining"", ""category"": ""blockchain"", ""difficulty"": ""medium"", ""question_type"": ""conceptual"", ""expected_chunks"": [""Blockchain_For_Beginners_A_EUBOF_Guide_parent_5"", ""Blockchain_For_Beginners_A_EUBOF_Guide_parent_6""], ""reference_answer"": ""Mining is the validation process where transactions are grouped into blocks. It takes computing effort to prove blocks, and once confirmed, they're easy to verify. Mining generates new bitcoins and builds trust by ensuring transactions are confirmed with significant computational work.""}",opt-v3-forced-search-f9c11837,1,"{""answer"": ""Mining in blockchain involves verifying transactions and adding them to the blockchain ledger. This process requires powerful computers to solve complex mathematical problems, which helps secure the network."", ""retrieved_chunks"": [""Blockchain_For_Beginners_A_EUBOF_Guide_parent_10"", ""Blockchain_For_Beginners_A_EUBOF_Guide_parent_8"", ""Blockchain_For_Beginners_A_EUBOF_Guide_parent_6"", ""Blockchain_For_Beginners_A_EUBOF_Guide_parent_9"", ""Blockchain_For_Beginners_A_EUBOF_Guide_parent_5""], ""retrieved_docs"": ""- NFTs are unique digital assets stored on a blockchain or distributed ledger.\n- The most popular blockchain for NFTs is Ethereum's ERC-721.\n\n---\n\n- Public blockchains are decentralized platforms that anyone can access and participate in.\n- Private blockchains are not open to the public and participation requires an invitation or permission.\n\n---\n\n- Mining in blockchain involves a process where transactions are verified and added to the blockchain ledger.\n- This process requires powerful computers to solve complex mathematical problems, which helps secure the network.\n\n---\n\n- Cryptocurrencies exist only in digital form, and they are not physically tangible like traditional money (e.g., cash or coins).  \n- They operate on blockchain technology, which is a decentralized and dist\n\n---\n\n- **Consensus Mechanism:** A consensus mechanism is a way to achieve agreement on a single data value among distributed processes or systems. In the context of blockchain, it's a set of rules or protocols that decide on the validity of the information added to the ledger.\n- **Cryptography:** Cryptography plays a crucial role in maintaining the decentralized, transparent, and tamper-proof nature of blockchain systems.""}","{""inputs"": {""question"": ""How does mining work in blockchain?""}, ""outputs"": {""answer"": ""Mining in blockchain involves verifying transactions and adding them to the blockchain ledger. This process requires powerful computers to solve complex mathematical problems, which helps secure the network."", ""retrieved_chunks"": [""Blockchain_For_Beginners_A_EUBOF_Guide_parent_10"", ""Blockchain_For_Beginners_A_EUBOF_Guide_parent_8"", ""Blockchain_For_Beginners_A_EUBOF_Guide_parent_6"", ""Blockchain_For_Beginners_A_EUBOF_Guide_parent_9"", ""Blockchain_For_Beginners_A_EUBOF_Guide_parent_5""], ""retrieved_docs"": ""- NFTs are unique digital assets stored on a blockchain or distributed ledger.\n- The most popular blockchain for NFTs is Ethereum's ERC-721.\n\n---\n\n- Public blockchains are decentralized platforms that anyone can access and participate in.\n- Private blockchains are not open to the public and participation requires an invitation or permission.\n\n---\n\n- Mining in blockchain involves a process where transactions are verified and added to the blockchain ledger.\n- This process requires powerful computers to solve complex mathematical problems, which helps secure the network.\n\n---\n\n- Cryptocurrencies exist only in digital form, and they are not physically tangible like traditional money (e.g., cash or coins).  \n- They operate on blockchain technology, which is a decentralized and dist\n\n---\n\n- **Consensus Mechanism:** A consensus mechanism is a way to achieve agreement on a single data value among distributed processes or systems. In the context of blockchain, it's a set of rules or protocols that decide on the validity of the information added to the ledger.\n- **Cryptography:** Cryptography plays a crucial role in maintaining the decentralized, transparent, and tamper-proof nature of blockchain systems.""}, ""session_id"": ""2f73e6dd-8a77-431f-8ca4-49a3a00f954a"", ""error"": null, ""extra"": {""metadata"": {""__ls_runner"": ""py_sdk_evaluate"", ""description"": ""Graph-enforced search - structurally impossible to skip search"", ""example_version"": ""2026-01-18T13:28:07.987878+00:00"", ""experiment_id"": ""opt-v3-forced-search"", ""experiment_name"": ""Optimized V3 (Forced Search)"", ""ls_example_category"": ""blockchain"", ""ls_example_dataset_split"": [""base""], ""ls_example_difficulty"": ""medium"", ""ls_example_question_type"": ""conceptual"", ""ls_example_test_id"": ""bc-004-mining"", ""ls_method"": ""traceable"", ""ls_run_depth"": 0, ""num_repetitions"": 1, ""revision_id"": ""ad71701-dirty"", ""version"": ""1.0""}, ""runtime"": {""langchain_core_version"": ""1.2.7"", ""langchain_version"": ""1.2.4"", ""library"": ""langsmith"", ""platform"": ""macOS-26.1-arm64-arm-64bit"", ""py_implementation"": ""CPython"", ""runtime"": ""python"", ""runtime_version"": ""3.11.14"", ""sdk"": ""langsmith-py"", ""sdk_version"": ""0.6.4""}}, ""run_type"": ""chain"", ""id"": ""019bd490-37ec-7f52-8ecb-cb5ae21779f0"", ""status"": ""success""}",success,,24.2545,3678,,1.0,1.0,24.2545,0.7,0.7732
