id,inputs,reference_outputs,session_name,repetition,outputs,run,status,error,latency,tokens,total_cost,answer_quality,faithfulness,latency,retrieval_relevance,semantic_similarity
7abe54c8-d865-449c-a0ac-54006a3e7bed,"{""question"": ""What are the advantages of JavaScript?""}","{""test_id"": ""js-002-advantages"", ""category"": ""javascript"", ""difficulty"": ""easy"", ""question_type"": ""factual"", ""expected_chunks"": [""javascript_tutorial_parent_8""], ""reference_answer"": ""JavaScript advantages include: less server interaction (validate input before sending to server), immediate feedback to visitors, increased interactivity with mouse/keyboard events, and richer interfaces with drag-and-drop and sliders.""}",opt-v3-forced-search-f9c11837,1,"{""answer"": ""Advantages of JavaScript include:\n\n- **Immediate feedback to visitors**\n- **Increased interactivity** through user actions like hovering or keyboard activation\n- **Richer interfaces** with features such as drag-and-drop components and sliders\n- **Client-Side Validation**: Can validate input before sending to the server, reducing server load\n- **Dynamic Web Pages**: Allows for interactive and dynamic content without full page reloads\n- **Event Handling**: Can trap user-initiated events like clicks or link navigation\n- **Ease of Implementation**: Integrated with HTML, making it easy to use"", ""retrieved_chunks"": [""javascript_tutorial_parent_8"", ""javascript_tutorial_parent_4"", ""javascript_tutorial_parent_7"", ""javascript_tutorial_parent_0""], ""retrieved_docs"": ""- **Less server interaction:** You can validate user input before sending the page\noff to the server. This saves server traffic, which means less load on your\nserver.\n- **Immediate feedback to the visitors:** They don't have to wait for a page\nreload to see if they have forgotten to enter something.\n- **Increased interactivity:** You can create interfaces that react when the user\nhovers over them with a mouse or activates them via the keyboard.\n- **Richer interfaces:** You can use JavaScript to include such items as drag-anddrop components and sliders to give a Rich Interface to your site visitors.\n\n---\n\n- Advantages of JavaScript\n- Client-Side JavaScript\n- Limitations of JavaScript\n\n---\n\n- It means that a web page need not be a static HTML, but can include programs that interact with the user, control the browser, and dynamically create HTML content.\n- The JavaScript client-side mechanism provides many advantages over traditional CGI server-side scripts. For example, you might use JavaScript to check if the user has entered a valid e-mail address in a form field.\n- JavaScript code is executed when the user submits the form, and only if all the entries are valid, they would be submitted to the Web Server.\n- JavaScript can be used to trap user-initiated events such as button clicks, link navigation, and other actions that the user initiates explicitly or implicitly.\n\n---\n\n- JavaScript is very easy to implement because it is integrated with HTML.""}","{""inputs"": {""question"": ""What are the advantages of JavaScript?""}, ""outputs"": {""answer"": ""Advantages of JavaScript include:\n\n- **Immediate feedback to visitors**\n- **Increased interactivity** through user actions like hovering or keyboard activation\n- **Richer interfaces** with features such as drag-and-drop components and sliders\n- **Client-Side Validation**: Can validate input before sending to the server, reducing server load\n- **Dynamic Web Pages**: Allows for interactive and dynamic content without full page reloads\n- **Event Handling**: Can trap user-initiated events like clicks or link navigation\n- **Ease of Implementation**: Integrated with HTML, making it easy to use"", ""retrieved_chunks"": [""javascript_tutorial_parent_8"", ""javascript_tutorial_parent_4"", ""javascript_tutorial_parent_7"", ""javascript_tutorial_parent_0""], ""retrieved_docs"": ""- **Less server interaction:** You can validate user input before sending the page\noff to the server. This saves server traffic, which means less load on your\nserver.\n- **Immediate feedback to the visitors:** They don't have to wait for a page\nreload to see if they have forgotten to enter something.\n- **Increased interactivity:** You can create interfaces that react when the user\nhovers over them with a mouse or activates them via the keyboard.\n- **Richer interfaces:** You can use JavaScript to include such items as drag-anddrop components and sliders to give a Rich Interface to your site visitors.\n\n---\n\n- Advantages of JavaScript\n- Client-Side JavaScript\n- Limitations of JavaScript\n\n---\n\n- It means that a web page need not be a static HTML, but can include programs that interact with the user, control the browser, and dynamically create HTML content.\n- The JavaScript client-side mechanism provides many advantages over traditional CGI server-side scripts. For example, you might use JavaScript to check if the user has entered a valid e-mail address in a form field.\n- JavaScript code is executed when the user submits the form, and only if all the entries are valid, they would be submitted to the Web Server.\n- JavaScript can be used to trap user-initiated events such as button clicks, link navigation, and other actions that the user initiates explicitly or implicitly.\n\n---\n\n- JavaScript is very easy to implement because it is integrated with HTML.""}, ""session_id"": ""2f73e6dd-8a77-431f-8ca4-49a3a00f954a"", ""error"": null, ""extra"": {""metadata"": {""__ls_runner"": ""py_sdk_evaluate"", ""description"": ""Graph-enforced search - structurally impossible to skip search"", ""example_version"": ""2026-01-18T13:28:02.249250+00:00"", ""experiment_id"": ""opt-v3-forced-search"", ""experiment_name"": ""Optimized V3 (Forced Search)"", ""ls_example_category"": ""javascript"", ""ls_example_dataset_split"": [""base""], ""ls_example_difficulty"": ""easy"", ""ls_example_question_type"": ""factual"", ""ls_example_test_id"": ""js-002-advantages"", ""ls_method"": ""traceable"", ""ls_run_depth"": 0, ""num_repetitions"": 1, ""revision_id"": ""ad71701-dirty"", ""version"": ""1.0""}, ""runtime"": {""langchain_core_version"": ""1.2.7"", ""langchain_version"": ""1.2.4"", ""library"": ""langsmith"", ""platform"": ""macOS-26.1-arm64-arm-64bit"", ""py_implementation"": ""CPython"", ""runtime"": ""python"", ""runtime_version"": ""3.11.14"", ""sdk"": ""langsmith-py"", ""sdk_version"": ""0.6.4""}}, ""run_type"": ""chain"", ""id"": ""019bd496-5bc5-7200-8d5e-55cf628fcf11"", ""status"": ""success""}",success,,36.7689,2609,,1.0,0.8,36.7689,0.7,0.9267
80461175-0916-4acc-b646-0e36fd8648ee,"{""question"": ""What is Python?""}","{""test_id"": ""edge-001-python"", ""category"": ""edge-case"", ""difficulty"": ""hard"", ""question_type"": ""out-of-scope"", ""expected_chunks"": [], ""reference_answer"": ""NOT_IN_DOCUMENTS - The system should indicate that Python is not covered in the available documents.""}",opt-v3-forced-search-f9c11837,1,"{""answer"": ""The documents don't contain this information."", ""retrieved_chunks"": [""javascript_tutorial_parent_21"", ""javascript_tutorial_parent_12"", ""javascript_tutorial_parent_20"", ""javascript_tutorial_parent_26""], ""retrieved_docs"": ""## **JavaScript in <body> and <head> Sections**  \n```\n\nYou can put your JavaScript code in <head> and <body> section altogether as\nfollows.\n\n```\n<html>  \n<head>  \n<script type=\""text/javascript\"">  \n<!-\nfunction sayHello() {  \nalert(\""Hello World\"")  \n}  \n//-->  \n</script>  \n</head>  \n<body>  \n<script t...\n\n---\n\n- The script tag alerts the browser program to start interpreting all the text between these tags as a script.\n- Your JavaScript syntax will look as follows.\n- This function can be used to write text, HTML, or both.\n\n---\n\n## **Warning for Non-JavaScript Browsers**  \nIf you have to do something important using JavaScript, then you can display a\nwarning message to the user using **<noscript>** tags.  \nYou can add a **noscript** block immediately after the script block as follows:  \n```\n<html>\n\n<body>\n\n<script language=...\n\n---\n\n### **typeof Operator**\n```\n\nThe **typeof** operator is a unary operator that is placed before its single operand,\nwhich can be of any type. Its value is a string indicating the data type of the operand.\n\n\nThe _typeof_ operator evaluates to \""number\"", \""string\"", or \""boolean\"" if its operand is a\nnumber...""}","{""inputs"": {""question"": ""What is Python?""}, ""outputs"": {""answer"": ""The documents don't contain this information."", ""retrieved_chunks"": [""javascript_tutorial_parent_21"", ""javascript_tutorial_parent_12"", ""javascript_tutorial_parent_20"", ""javascript_tutorial_parent_26""], ""retrieved_docs"": ""## **JavaScript in <body> and <head> Sections**  \n```\n\nYou can put your JavaScript code in <head> and <body> section altogether as\nfollows.\n\n```\n<html>  \n<head>  \n<script type=\""text/javascript\"">  \n<!-\nfunction sayHello() {  \nalert(\""Hello World\"")  \n}  \n//-->  \n</script>  \n</head>  \n<body>  \n<script t...\n\n---\n\n- The script tag alerts the browser program to start interpreting all the text between these tags as a script.\n- Your JavaScript syntax will look as follows.\n- This function can be used to write text, HTML, or both.\n\n---\n\n## **Warning for Non-JavaScript Browsers**  \nIf you have to do something important using JavaScript, then you can display a\nwarning message to the user using **<noscript>** tags.  \nYou can add a **noscript** block immediately after the script block as follows:  \n```\n<html>\n\n<body>\n\n<script language=...\n\n---\n\n### **typeof Operator**\n```\n\nThe **typeof** operator is a unary operator that is placed before its single operand,\nwhich can be of any type. Its value is a string indicating the data type of the operand.\n\n\nThe _typeof_ operator evaluates to \""number\"", \""string\"", or \""boolean\"" if its operand is a\nnumber...""}, ""session_id"": ""2f73e6dd-8a77-431f-8ca4-49a3a00f954a"", ""error"": null, ""extra"": {""metadata"": {""__ls_runner"": ""py_sdk_evaluate"", ""description"": ""Graph-enforced search - structurally impossible to skip search"", ""example_version"": ""2026-01-18T13:28:11.363026+00:00"", ""experiment_id"": ""opt-v3-forced-search"", ""experiment_name"": ""Optimized V3 (Forced Search)"", ""ls_example_category"": ""edge-case"", ""ls_example_dataset_split"": [""base""], ""ls_example_difficulty"": ""hard"", ""ls_example_question_type"": ""out-of-scope"", ""ls_example_test_id"": ""edge-001-python"", ""ls_method"": ""traceable"", ""ls_run_depth"": 0, ""num_repetitions"": 1, ""revision_id"": ""ad71701-dirty"", ""version"": ""1.0""}, ""runtime"": {""langchain_core_version"": ""1.2.7"", ""langchain_version"": ""1.2.4"", ""library"": ""langsmith"", ""platform"": ""macOS-26.1-arm64-arm-64bit"", ""py_implementation"": ""CPython"", ""runtime"": ""python"", ""runtime_version"": ""3.11.14"", ""sdk"": ""langsmith-py"", ""sdk_version"": ""0.6.4""}}, ""run_type"": ""chain"", ""id"": ""019bd48c-3f8a-74b2-8552-a73ac5d21261"", ""status"": ""success""}",success,,50.7594,7943,,0.4,0.0,50.7594,0.0,0.1879
82f91d38-eadb-48f8-94db-e0e610c018b9,"{""question"": ""What is the difference between blockchain and traditional databases?""}","{""test_id"": ""bc-008-vs-traditional-db"", ""category"": ""blockchain"", ""difficulty"": ""hard"", ""question_type"": ""comparison"", ""expected_chunks"": [""Blockchain_For_Beginners_A_EUBOF_Guide_parent_7""], ""reference_answer"": ""Traditional databases are centralized with single entity control, easy data modification, and admin-controlled access. Blockchain is decentralized across many nodes, data is immutable once added, transparent to all participants, and uses cryptographic security.""}",opt-v3-forced-search-f9c11837,1,"{""answer"": ""Blockchain and traditional databases differ in that traditional databases are centralized, meaning a single entity controls transaction records and data. In contrast, blockchain is decentralized, eliminating the need for gatekeepers and reducing vulnerabilities from single points of failure. Blockchain networks enable trustless transactions through peer-to-peer interaction without intermediaries, such as seen with Bitcoin."", ""retrieved_chunks"": [""Blockchain_For_Beginners_A_EUBOF_Guide_parent_7"", ""Blockchain_For_Beginners_A_EUBOF_Guide_parent_6""], ""retrieved_docs"": ""- A practical example of how decentralization works on blockchain is Bitcoin (see previous section).\n- When we discuss blockchain cryptography, this entails the following components:\n  - Digital Signatures:** the purpose of digital signatures is to ensure security and authenticity.\n  - Hash Functions** are used to maintain the integrity and the order of the blockchain.\n\n---\n\n- Centralization is a fundamental aspect of today’s record-keeping systems, where a single entity can control transaction records and data.\n- Decentralized systems eliminate the need for gatekeepers and the vulnerabilities of single points of failure.\n- Blockchain networks like Bitcoin ease trustless financial transactions by allowing parties to interact peer-to-peer without an intermediary.""}","{""inputs"": {""question"": ""What is the difference between blockchain and traditional databases?""}, ""outputs"": {""answer"": ""Blockchain and traditional databases differ in that traditional databases are centralized, meaning a single entity controls transaction records and data. In contrast, blockchain is decentralized, eliminating the need for gatekeepers and reducing vulnerabilities from single points of failure. Blockchain networks enable trustless transactions through peer-to-peer interaction without intermediaries, such as seen with Bitcoin."", ""retrieved_chunks"": [""Blockchain_For_Beginners_A_EUBOF_Guide_parent_7"", ""Blockchain_For_Beginners_A_EUBOF_Guide_parent_6""], ""retrieved_docs"": ""- A practical example of how decentralization works on blockchain is Bitcoin (see previous section).\n- When we discuss blockchain cryptography, this entails the following components:\n  - Digital Signatures:** the purpose of digital signatures is to ensure security and authenticity.\n  - Hash Functions** are used to maintain the integrity and the order of the blockchain.\n\n---\n\n- Centralization is a fundamental aspect of today’s record-keeping systems, where a single entity can control transaction records and data.\n- Decentralized systems eliminate the need for gatekeepers and the vulnerabilities of single points of failure.\n- Blockchain networks like Bitcoin ease trustless financial transactions by allowing parties to interact peer-to-peer without an intermediary.""}, ""session_id"": ""2f73e6dd-8a77-431f-8ca4-49a3a00f954a"", ""error"": null, ""extra"": {""metadata"": {""__ls_runner"": ""py_sdk_evaluate"", ""description"": ""Graph-enforced search - structurally impossible to skip search"", ""example_version"": ""2026-01-18T13:28:09.674502+00:00"", ""experiment_id"": ""opt-v3-forced-search"", ""experiment_name"": ""Optimized V3 (Forced Search)"", ""ls_example_category"": ""blockchain"", ""ls_example_dataset_split"": [""base""], ""ls_example_difficulty"": ""hard"", ""ls_example_question_type"": ""comparison"", ""ls_example_test_id"": ""bc-008-vs-traditional-db"", ""ls_method"": ""traceable"", ""ls_run_depth"": 0, ""num_repetitions"": 1, ""revision_id"": ""ad71701-dirty"", ""version"": ""1.0""}, ""runtime"": {""langchain_core_version"": ""1.2.7"", ""langchain_version"": ""1.2.4"", ""library"": ""langsmith"", ""platform"": ""macOS-26.1-arm64-arm-64bit"", ""py_implementation"": ""CPython"", ""runtime"": ""python"", ""runtime_version"": ""3.11.14"", ""sdk"": ""langsmith-py"", ""sdk_version"": ""0.6.4""}}, ""run_type"": ""chain"", ""id"": ""019bd48e-0d76-73e0-a09b-428cfe9fe8bf"", ""status"": ""success""}",success,,33.9247,3269,,1.0,0.8,33.9247,0.7,0.9025
902619b4-9ad8-4e8f-8209-5dc31818d87c,"{""question"": ""What development tools can I use for JavaScript?""}","{""test_id"": ""js-003-dev-tools"", ""category"": ""javascript"", ""difficulty"": ""easy"", ""question_type"": ""factual"", ""expected_chunks"": [""javascript_tutorial_parent_10""], ""reference_answer"": ""JavaScript development tools include: simple text editors like Notepad, Microsoft FrontPage, Macromedia Dreamweaver MX, and Macromedia HomeSite 5. Since JavaScript is interpreted in the browser, you don't need a compiler.""}",opt-v3-forced-search-f9c11837,1,"{""answer"": ""You can use Microsoft FrontPage, Macromedia Dreamweaver MX, or Macromedia HomeSite 5 for JavaScript development. These tools provide features to assist in creating interactive websites and managing personal sites effectively."", ""retrieved_chunks"": [""javascript_tutorial_parent_10"", ""javascript_tutorial_parent_4"", ""javascript_tutorial_parent_6"", ""javascript_tutorial_parent_0""], ""retrieved_docs"": ""- Microsoft FrontPage: Microsoft has developed a popular HTML editor called FrontPage. FrontPage also provides web developers with a number of JavaScript tools to assist in the creation of interactive websites.\n- Macromedia Dreamweaver MX: Macromedia Dreamweaver MX is a very popular HTML and JavaScript editor in the professional web development crowd. It provides several handy prebuilt JavaScript components, integrates well with databases, and conforms to new standards such as XHTML and XML.\n- Macromedia HomeSite 5: HomeSite 5 is a well-liked HTML and JavaScript editor from Macromedia that can be used to manage personal websites effectively.\n\n---\n\n## **Table of Contents**  \nAbout the Tutorial .............................................................................................................................................\nAudience ..........................................................................................................\n\n---\n\n## **What is JavaScript?**  \nJavascript is a dynamic computer programming language. It is lightweight and most\ncommonly used as a part of web pages, whose implementations allow client-side\nscript to interact with the user and make dynamic pages. It is an interpreted\nprogramming language with object-...\n\n---\n\n- JavaScript is very easy to implement because it is integrated with HTML.""}","{""inputs"": {""question"": ""What development tools can I use for JavaScript?""}, ""outputs"": {""answer"": ""You can use Microsoft FrontPage, Macromedia Dreamweaver MX, or Macromedia HomeSite 5 for JavaScript development. These tools provide features to assist in creating interactive websites and managing personal sites effectively."", ""retrieved_chunks"": [""javascript_tutorial_parent_10"", ""javascript_tutorial_parent_4"", ""javascript_tutorial_parent_6"", ""javascript_tutorial_parent_0""], ""retrieved_docs"": ""- Microsoft FrontPage: Microsoft has developed a popular HTML editor called FrontPage. FrontPage also provides web developers with a number of JavaScript tools to assist in the creation of interactive websites.\n- Macromedia Dreamweaver MX: Macromedia Dreamweaver MX is a very popular HTML and JavaScript editor in the professional web development crowd. It provides several handy prebuilt JavaScript components, integrates well with databases, and conforms to new standards such as XHTML and XML.\n- Macromedia HomeSite 5: HomeSite 5 is a well-liked HTML and JavaScript editor from Macromedia that can be used to manage personal websites effectively.\n\n---\n\n## **Table of Contents**  \nAbout the Tutorial .............................................................................................................................................\nAudience ..........................................................................................................\n\n---\n\n## **What is JavaScript?**  \nJavascript is a dynamic computer programming language. It is lightweight and most\ncommonly used as a part of web pages, whose implementations allow client-side\nscript to interact with the user and make dynamic pages. It is an interpreted\nprogramming language with object-...\n\n---\n\n- JavaScript is very easy to implement because it is integrated with HTML.""}, ""session_id"": ""2f73e6dd-8a77-431f-8ca4-49a3a00f954a"", ""error"": null, ""extra"": {""metadata"": {""__ls_runner"": ""py_sdk_evaluate"", ""description"": ""Graph-enforced search - structurally impossible to skip search"", ""example_version"": ""2026-01-18T13:28:02.668537+00:00"", ""experiment_id"": ""opt-v3-forced-search"", ""experiment_name"": ""Optimized V3 (Forced Search)"", ""ls_example_category"": ""javascript"", ""ls_example_dataset_split"": [""base""], ""ls_example_difficulty"": ""easy"", ""ls_example_question_type"": ""factual"", ""ls_example_test_id"": ""js-003-dev-tools"", ""ls_method"": ""traceable"", ""ls_run_depth"": 0, ""num_repetitions"": 1, ""revision_id"": ""ad71701-dirty"", ""version"": ""1.0""}, ""runtime"": {""langchain_core_version"": ""1.2.7"", ""langchain_version"": ""1.2.4"", ""library"": ""langsmith"", ""platform"": ""macOS-26.1-arm64-arm-64bit"", ""py_implementation"": ""CPython"", ""runtime"": ""python"", ""runtime_version"": ""3.11.14"", ""sdk"": ""langsmith-py"", ""sdk_version"": ""0.6.4""}}, ""run_type"": ""chain"", ""id"": ""019bd495-fb0f-7f21-a384-aae60bb7c28d"", ""status"": ""success""}",success,,18.8617,2202,,1.0,0.5,18.8617,0.7,0.7936
93657143-fda9-459d-a3ef-92f8f28ce933,"{""question"": ""What is DeFi and how is it different from traditional finance?""}","{""test_id"": ""bc-009-defi"", ""category"": ""blockchain"", ""difficulty"": ""hard"", ""question_type"": ""comparison"", ""expected_chunks"": [""Blockchain_For_Beginners_A_EUBOF_Guide_parent_10""], ""reference_answer"": ""DeFi (Decentralized Finance) operates on decentralized, peer-to-peer models through smart contracts, bypassing traditional intermediaries. Unlike TradFi which is centralized, custodial, and requires identity verification, DeFi is open, permissionless, and censorship-resistant.""}",opt-v3-forced-search-f9c11837,1,"{""answer"": ""What specific topic are you asking about?"", ""retrieved_chunks"": [], ""retrieved_docs"": ""No documents retrieved""}","{""inputs"": {""question"": ""What is DeFi and how is it different from traditional finance?""}, ""outputs"": {""answer"": ""What specific topic are you asking about?"", ""retrieved_chunks"": [], ""retrieved_docs"": ""No documents retrieved""}, ""session_id"": ""2f73e6dd-8a77-431f-8ca4-49a3a00f954a"", ""error"": null, ""extra"": {""metadata"": {""__ls_runner"": ""py_sdk_evaluate"", ""description"": ""Graph-enforced search - structurally impossible to skip search"", ""example_version"": ""2026-01-18T13:28:10.137965+00:00"", ""experiment_id"": ""opt-v3-forced-search"", ""experiment_name"": ""Optimized V3 (Forced Search)"", ""ls_example_category"": ""blockchain"", ""ls_example_dataset_split"": [""base""], ""ls_example_difficulty"": ""hard"", ""ls_example_question_type"": ""comparison"", ""ls_example_test_id"": ""bc-009-defi"", ""ls_method"": ""traceable"", ""ls_run_depth"": 0, ""num_repetitions"": 1, ""revision_id"": ""ad71701-dirty"", ""version"": ""1.0""}, ""runtime"": {""langchain_core_version"": ""1.2.7"", ""langchain_version"": ""1.2.4"", ""library"": ""langsmith"", ""platform"": ""macOS-26.1-arm64-arm-64bit"", ""py_implementation"": ""CPython"", ""runtime"": ""python"", ""runtime_version"": ""3.11.14"", ""sdk"": ""langsmith-py"", ""sdk_version"": ""0.6.4""}}, ""run_type"": ""chain"", ""id"": ""019bd48e-09b2-7972-904e-468e0e2ea691"", ""status"": ""success""}",success,,0.0048,0,,0.4,0.0,0.0048,0.0,0.1868
